{
  "schema_version": 1,
  "project_key": "class-kit",
  "status": "completed",
  "dispositions": [
    {
      "source_kind": "project_candidate",
      "source_ref": "cand_classkit_admin_sdk_v0123_port5175",
      "disposition": "applied_to_project_memory",
      "reason": "Current app manifests pin @class-kit/react to v0.1.23 and the Admin Vite configuration sets port 5175; the operator documentation now records both. repository-identity.json reports an origin while the existing draft notes a conflicting local-only statement in repository documentation; that checkout snapshot was retained as run evidence and did not drive canonical identity prose.",
      "output_refs": [
        "draft-wiki/operator-workflows-and-local-apps.md"
      ]
    },
    {
      "source_kind": "project_candidate",
      "source_ref": "cand_classkit_sdk_source_update_tags",
      "disposition": "applied_to_project_memory",
      "reason": "The current SDK switcher reads class-kit-sdk/package.json, verifies its exact remote tag, uses an isolated Bun cache for the standalone Admin lockfile, and refreshes workspaces with npm update before the build. The maintained workflow and stale app-version references were corrected.",
      "output_refs": [
        "draft-wiki/operator-workflows-and-local-apps.md",
        "draft-wiki/architecture-and-boundaries.md",
        "draft-wiki/classes-and-registrations.md",
        "draft-wiki/product-administration-and-reset.md"
      ]
    },
    {
      "source_kind": "project_candidate",
      "source_ref": "cand_classkit_20260725_sdk_source_release_version_rule",
      "disposition": "already_covered",
      "reason": "Its durable release-resolution claims are covered by the SDK-switcher documentation update attributed to cand_classkit_sdk_source_update_tags, based directly on the current script rather than the stop report.",
      "output_refs": []
    },
    {
      "source_kind": "project_candidate",
      "source_ref": "cand_classkit_20260725_v0123_release",
      "disposition": "applied_to_project_memory",
      "reason": "Current changelog, API/SDK documentation, capability implementation, and focused regression-test source verify v0.1.23 customer and membership read permissions, flags, precedence, and endpoint guards. The authorization documentation now corrects its prior level-gated read description.",
      "output_refs": [
        "draft-wiki/authorization-and-roles.md"
      ]
    },
    {
      "source_kind": "project_candidate",
      "source_ref": "cand_classkit_release_0_1_22_live",
      "disposition": "applied_to_project_memory",
      "reason": "The current product-user-roles handler, SDK facade, and API/SDK regression tests verify the released assignable-role catalog. The authorization page now documents list_assignable and its product-scoped permission boundary.",
      "output_refs": [
        "draft-wiki/authorization-and-roles.md"
      ]
    },
    {
      "source_kind": "project_handoff",
      "source_ref": "handoff_classkit_20260725_noya_v0123",
      "disposition": "belongs_to_other_layer",
      "reason": "This requests verification and possible remediation in the downstream Noya repository; it does not itself add a ClassKit Project Memory fact beyond the verified v0.1.23 contract.",
      "output_refs": []
    },
    {
      "source_kind": "project_handoff",
      "source_ref": "handoff_classkit_20260724_read_permission_migration",
      "disposition": "already_covered",
      "reason": "The proposed migration is implemented in the current repository and its resulting durable contract is documented from current code and regression-test evidence in this pass.",
      "output_refs": []
    },
    {
      "source_kind": "project_handoff",
      "source_ref": "handoff_classkit_customers_authorization_signals",
      "disposition": "already_covered",
      "reason": "Although phrased as a decision lead, the current v0.1.23 changelog and API/SDK contracts explicitly establish customers.read, memberships.read, and their two capability flags, including the platform-level alternative; the source's unresolved framing is stale.",
      "output_refs": []
    },
    {
      "source_kind": "project_handoff",
      "source_ref": "handoff_classkit_assignable_roles_parallel_impl",
      "disposition": "already_covered",
      "reason": "The requested assignable-role implementation is present in the current handler and SDK facade and is documented from repository evidence in this pass; the handoff itself is not additional durable evidence.",
      "output_refs": []
    }
  ],
  "touched_paths": [
    "draft-wiki/operator-workflows-and-local-apps.md",
    "draft-wiki/authorization-and-roles.md",
    "draft-wiki/architecture-and-boundaries.md",
    "draft-wiki/classes-and-registrations.md",
    "draft-wiki/product-administration-and-reset.md"
  ],
  "evidence_paths": [
    "repository-identity.json",
    "target-repo/apps/class-kit-admin/package.json",
    "target-repo/apps/class-kit-admin/bun.lock",
    "target-repo/apps/class-kit-admin/vite.config.ts",
    "target-repo/apps/demo2/package.json",
    "target-repo/scripts/class-kit-sdk-source.mjs",
    "target-repo/docs/changelog.md",
    "target-repo/docs/product-shape.md",
    "target-repo/docs/api/backend-api.md",
    "target-repo/docs/sdk/client-sdk.md",
    "target-repo/docs/repositories/structure.md",
    "target-repo/class-kit-api/supabase/functions/_shared/management-capabilities.ts",
    "target-repo/class-kit-api/supabase/functions/_shared/management-capabilities.test.ts",
    "target-repo/class-kit-api/supabase/functions/class-kit-customers/index.ts",
    "target-repo/class-kit-api/supabase/functions/class-kit-memberships/index.ts",
    "target-repo/class-kit-api/supabase/functions/class-kit-product-context/index.test.ts",
    "target-repo/class-kit-api/supabase/functions/class-kit-product-user-roles/index.ts",
    "target-repo/class-kit-api/supabase/functions/class-kit-product-user-roles/index.test.ts",
    "target-repo/class-kit-api/supabase/tests/customer_membership_read_capabilities.sql",
    "target-repo/class-kit-sdk/src/client/class-kit-client.ts",
    "target-repo/class-kit-sdk/tests/assignable-product-roles.test.mjs"
  ],
  "known_gaps": []
}
