{
  "schema_version": 1,
  "project_key": "class-kit",
  "status": "completed",
  "dispositions": [
    {
      "source_kind": "project_candidate",
      "source_ref": "cand_classkit_ghost_client_level75_permission_contract",
      "disposition": "insufficient_evidence",
      "reason": "Searched the current Edge Function, migration, SDK, documentation, and regression-test sources. They contain the general level-75 product guard but no ghost-client resource, endpoint, permission key, or test establishing this claimed surface-wide contract. The sanitized identity record also conflicts with draft-wiki/index.md's master-branch wording; it was retained solely as run evidence and did not justify a prose edit.",
      "output_refs": []
    },
    {
      "source_kind": "project_candidate",
      "source_ref": "cand_classkit_20260719_customer_id_transition_review",
      "disposition": "deferred_unsafe_change",
      "reason": "This is explicitly an unaccepted identity-policy proposal. Current code and canonical docs use authenticated product users and caller-bound profile updates, not a customer_id/user_id compatibility transition; implementation alone cannot settle the proposed policy.",
      "output_refs": []
    },
    {
      "source_kind": "project_candidate",
      "source_ref": "cand_classkit_customer_lifecycle_no_hard_delete",
      "disposition": "deferred_unsafe_change",
      "reason": "The source explicitly says the no-hard-delete and audited-merge rule lacks product-owner confirmation. No current customer-record lifecycle resource or regression coverage establishes those proposed states, so documenting them would incorrectly turn an open policy into a contract.",
      "output_refs": []
    },
    {
      "source_kind": "project_candidate",
      "source_ref": "cand_classkit_20260719_product_customer_auto_creation",
      "disposition": "deferred_unsafe_change",
      "reason": "The source is a confirmation question, not an adopted rule. Current access evaluation creates product-user membership when policy permits, but current migrations, endpoints, and tests provide no product_customer backfill, transactional creation, or login-revocation customer-retention contract.",
      "output_refs": []
    },
    {
      "source_kind": "project_candidate",
      "source_ref": "cand_classkit_customer_access_boundary_01",
      "disposition": "deferred_unsafe_change",
      "reason": "The proposed separation and ghost-to-identity linking policy remain discussion-state evidence. The current repository has established customer-facing profile/product-user and manager domains, but no customer-management or ghost-linking API contract from which to infer acceptance of this proposed boundary.",
      "output_refs": []
    },
    {
      "source_kind": "project_candidate",
      "source_ref": "cand_classkit_20260719_cross_product_privacy_rule",
      "disposition": "deferred_unsafe_change",
      "reason": "The privacy-sensitive cross-product matching rule is framed as a policy needing confirmation. Current product-scoped role and access code supports isolation, but no customer identity-match or linking flow exists to establish the proposed non-disclosure rule as a complete durable contract.",
      "output_refs": []
    },
    {
      "source_kind": "project_handoff",
      "source_ref": "handoff_classkit_customer_guard_verify_01",
      "disposition": "belongs_to_other_layer",
      "reason": "This is an engineering verification handoff. The snapshot has no customer-management Edge Function to verify; its existing level-75 and permission-key guards are already documented for the implemented manager domains, so no Project Memory update is warranted.",
      "output_refs": []
    },
    {
      "source_kind": "project_handoff",
      "source_ref": "handoff_classkit_20260719_confirm_permission_split",
      "disposition": "belongs_to_other_layer",
      "reason": "The handoff requests acceptance and backend alignment for a proposed permission split. That product/engineering decision has not become an implemented customer surface in the current repository and is not durable Project Memory input.",
      "output_refs": []
    },
    {
      "source_kind": "project_handoff",
      "source_ref": "handoff_classkit_20260719_customer_id_transition_review",
      "disposition": "belongs_to_other_layer",
      "reason": "This is a requested implementation/acceptance follow-up for an unadopted compatibility migration. Current repository evidence does not implement the customer_id transition, so it belongs to downstream product and engineering work rather than Project Memory maintenance.",
      "output_refs": []
    }
  ],
  "touched_paths": [],
  "evidence_paths": [
    "repository-identity.json",
    "draft-wiki/index.md",
    "target-repo/docs/repositories/structure.md",
    "target-repo/docs/api/backend-api.md",
    "target-repo/docs/product-shape.md",
    "target-repo/class-kit-api/supabase/functions/_shared/permissions.ts",
    "target-repo/class-kit-api/supabase/functions",
    "target-repo/class-kit-api/supabase/migrations",
    "target-repo/class-kit-api/supabase/tests"
  ],
  "known_gaps": []
}
