{
  "dispositions": [
    {
      "disposition": "deferred_unsafe_change",
      "output_refs": [],
      "reason": "Current migration and API documentation establish class_kit.users as an authenticated product-membership table keyed by (product_id, user_id), not a customer record. No customer_id, nullable-auth customer model, or ghost-support migration was found. The candidate's proposed evolution remains an explicit unresolved data-model decision, so documenting it as current behavior would be unsafe.",
      "source_kind": "project_candidate",
      "source_ref": "cand_classkit_20260720_customer_model_evolution"
    },
    {
      "disposition": "deferred_unsafe_change",
      "output_refs": [],
      "reason": "The source asks for product approval. Current code stores shared profile fields in class_kit.profiles and product metadata in class_kit.users.metadata, but it contains no linked-customer snapshot, copy-once policy, or synchronization contract. Incidental current storage separation does not settle the proposed product policy.",
      "source_kind": "project_candidate",
      "source_ref": "cand_classkit_20260719_linked_customer_sync_policy"
    },
    {
      "disposition": "deferred_unsafe_change",
      "output_refs": [],
      "reason": "No current schema, API, SDK, or regression test uses customer_id or exposes the proposed user_id compatibility translation. The candidate explicitly presents a future migration choice, not an adopted contract.",
      "source_kind": "project_candidate",
      "source_ref": "cand_classkit_20260719_customer_id_transition_review"
    },
    {
      "disposition": "deferred_unsafe_change",
      "output_refs": [],
      "reason": "The candidate is an unapproved customer-lifecycle policy. Current product-user status supports active/inactive, but the authorized platform product-reset path permanently deletes non-admin class_kit.users rows and their operational history; its SQL regression covers that reset. This distinction contradicts treating a universal no-hard-delete rule as current behavior, and no customer-specific retirement or audited-merge contract was found.",
      "source_kind": "project_candidate",
      "source_ref": "cand_classkit_customer_lifecycle_no_hard_delete"
    },
    {
      "disposition": "deferred_unsafe_change",
      "output_refs": [],
      "reason": "Current access evaluation can activate an authenticated product user, but no product_customer table, customer backfill, transactional customer-record creation, or access-revocation preservation rule exists in the inspected schema, functions, SDK, or tests. The source is explicitly a proposed policy question.",
      "source_kind": "project_candidate",
      "source_ref": "cand_classkit_20260719_product_customer_auto_creation"
    },
    {
      "disposition": "deferred_unsafe_change",
      "output_refs": [],
      "reason": "Current documentation and functions distinguish product-user/access administration from customer-facing product flows, but there is no customer-management resource, ghost identity, explicit linking operation, or audited merge contract to verify. The requested boundary is a proposed API/product decision rather than an implemented durable contract.",
      "source_kind": "project_candidate",
      "source_ref": "cand_classkit_customer_access_boundary_01"
    },
    {
      "disposition": "deferred_unsafe_change",
      "output_refs": [],
      "reason": "The existing product-scoped membership model is documented and enforced by the (product_id, user_id) key, but the stronger rule that cross-product contact matches must never be revealed or linked has no current matching/linking implementation or regression coverage. The source itself asks whether any authorized exception should exist, so this privacy policy remains open.",
      "source_kind": "project_candidate",
      "source_ref": "cand_classkit_20260719_cross_product_privacy_rule"
    },
    {
      "disposition": "deferred_unsafe_change",
      "output_refs": [],
      "reason": "This handoff expressly requests confirmation before implementation. Repository evidence shows separate shared-profile and product-metadata storage, but does not establish a linked-customer snapshot or no-sync policy; the handoff is therefore a decision lead, not durable Project Memory evidence.",
      "source_kind": "project_handoff",
      "source_ref": "handoff_classkit_20260719_confirm_linked_customer_sync_policy"
    }
  ],
  "evidence_paths": [
    "repository-identity.json",
    "target-repo/class-kit-api/supabase/migrations/20260607112136_product_role_foundation.sql",
    "target-repo/class-kit-api/supabase/migrations/20260705053145_product_user_profile_metadata_membership_links.sql",
    "target-repo/class-kit-api/supabase/migrations/20260702120000_truncate_product_admin_action.sql",
    "target-repo/class-kit-api/supabase/tests/truncate_product_admin_action.sql",
    "target-repo/class-kit-api/supabase/functions/class-kit-product-users/index.ts",
    "target-repo/docs/api/backend-api.md",
    "draft-wiki/architecture-and-boundaries.md",
    "draft-wiki/product-administration-and-reset.md",
    "draft-wiki/product-access-and-authentication.md"
  ],
  "known_gaps": [],
  "project_key": "class-kit",
  "schema_version": 1,
  "status": "completed",
  "touched_paths": []
}
