{
  "dispositions": [
    {
      "disposition": "applied_to_project_memory",
      "output_refs": [
        "draft-wiki/session-memory-and-experience-ingest.md"
      ],
      "reason": "Current worker code and regression tests verify that session.start is excluded from curator evidence and that the versioned repair service performs guarded, provenance-preserving retractions; the durable ingest and repair boundary was added.",
      "source_kind": "project_candidate",
      "source_ref": "cand_llmwiki_session_repair_boundary_20260809"
    },
    {
      "disposition": "applied_to_project_memory",
      "output_refs": [
        "draft-wiki/query-status-and-agent-interfaces.md"
      ],
      "reason": "Current query services and regression tests verify semantic-first Session Memory ordering, inactive-window expansion, and the absence of forced Project Memory and-facet promotion; the stale recency description was corrected.",
      "source_kind": "project_candidate",
      "source_ref": "cand_llmwiki_query_cleanup_20260809"
    },
    {
      "disposition": "already_covered",
      "output_refs": [],
      "reason": "The final draft already records the current docs/CLI.md versus docs/ROADMAP.md Step 12 conflict, including the requirement for a distinct Droplet Bot identity and the fact that no clean-cohort key is named.",
      "source_kind": "project_candidate",
      "source_ref": "cand_llmwiki_dropletbot_bootstrap_docs_drift_20260806"
    },
    {
      "disposition": "already_covered",
      "output_refs": [],
      "reason": "Current ingest and auto-maintenance code plus regression tests verify terminal replay reconciliation before selection, reconciled_count reporting, and no-progress termination; these durable workflow facts are already documented in the final Session Memory page.",
      "source_kind": "project_candidate",
      "source_ref": "cand_llmwiki_ingest_replay_reconciliation_20260720"
    },
    {
      "disposition": "deferred_unsafe_change",
      "output_refs": [],
      "reason": "This is an explicitly unresolved durable policy decision. repository-identity.json is only checkout/run evidence and cannot decide whether stable repository identity may appear in canonical prose; no approved durable-policy source was found.",
      "source_kind": "project_candidate",
      "source_ref": "cand_llmwiki_repo_identity_prose_policy_20260716"
    },
    {
      "disposition": "belongs_to_other_layer",
      "output_refs": [],
      "reason": "This requests a live operator database mutation and journal review. The repository verifies the repair command and its safeguards, which are documented, but this isolated documentation pass cannot establish a live llm-wiki retraction result.",
      "source_kind": "project_handoff",
      "source_ref": "handoff_llmwiki_live_session_repair_20260809"
    },
    {
      "disposition": "already_covered",
      "output_refs": [],
      "reason": "The final draft already documents the verified CLI example and Step 12 clean-identity contradiction as a current operator-docs issue.",
      "source_kind": "project_handoff",
      "source_ref": "handoff_llmwiki_dropletbot_docs_reconcile_20260806"
    },
    {
      "disposition": "already_covered",
      "output_refs": [],
      "reason": "Current worker and query regression tests verify the reported control-event and stale-result fixes; the resulting durable behavior is covered by this pass's Session Memory and query updates.",
      "source_kind": "project_handoff",
      "source_ref": "handoff_llmwiki_session_memory_curation_audit_20260721"
    },
    {
      "disposition": "already_covered",
      "output_refs": [],
      "reason": "The cited Project Memory subjects were checked against current code, docs, and tests; this final draft already preserves the Step 12 conflict and corrects the stale query behavior it exposes.",
      "source_kind": "project_handoff",
      "source_ref": "handoff_llmwiki_project_refresh_20260721"
    },
    {
      "disposition": "belongs_to_other_layer",
      "output_refs": [],
      "reason": "This is a request to begin an external Step 12 engineering session from a run-local handoff, not a verified durable Project Memory fact requiring a documentation update.",
      "source_kind": "project_handoff",
      "source_ref": "handoff_llmwiki_step12_followup_20260720_0808"
    },
    {
      "disposition": "deferred_unsafe_change",
      "output_refs": [],
      "reason": "The handoff requests the same explicitly open identity-prose policy. No current approved durable-policy source resolves it, and checkout evidence in repository-identity.json must remain report evidence rather than canonical prose.",
      "source_kind": "project_handoff",
      "source_ref": "handoff_llmwiki_identity_prose_policy_20260719_0932"
    },
    {
      "disposition": "deferred_unsafe_change",
      "output_refs": [],
      "reason": "This handoff explicitly asks for a product decision about a separate claimable-row reporting contract; current implementation alone cannot settle that policy.",
      "source_kind": "project_handoff",
      "source_ref": "handoff_llmwiki_claimable_rows_labeling_20260718_0848"
    },
    {
      "disposition": "deferred_unsafe_change",
      "output_refs": [],
      "reason": "This handoff explicitly leaves the claimable-count reporting contract to a later policy decision, with no current approved decision source to canonize.",
      "source_kind": "project_handoff",
      "source_ref": "handoff_llmwiki_claimable_count_contract_20260718_0836"
    },
    {
      "disposition": "deferred_unsafe_change",
      "output_refs": [],
      "reason": "The requested decision about raw versus claimable ingest reporting is open policy, not a fact that can be resolved from incidental current behavior alone.",
      "source_kind": "project_handoff",
      "source_ref": "handoff_llmwiki_verify_raw_row_count_20260718"
    },
    {
      "disposition": "already_covered",
      "output_refs": [],
      "reason": "The inspected final draft contains no repository-identity.json links or checkout-identity prose; repository-identity.json remains run evidence only.",
      "source_kind": "project_handoff",
      "source_ref": "handoff_llmwiki_strip_identity_links_20260716"
    }
  ],
  "evidence_paths": [
    "repository-identity.json",
    "target-repo/src/ingest/worker.ts",
    "target-repo/src/memory/session-memory-policy.ts",
    "target-repo/src/memory/session-memory-repair-service.ts",
    "target-repo/src/memory/session-memory-query.ts",
    "target-repo/src/query/project-memory-query-service.ts",
    "target-repo/src/ingest/ingest-service.ts",
    "target-repo/src/maintenance/auto-memory-maintenance.ts",
    "target-repo/docs/CLI.md",
    "target-repo/docs/ROADMAP.md",
    "target-repo/tests/ingest/worker.test.ts",
    "target-repo/tests/memory/session-memory-repair-service.test.ts",
    "target-repo/tests/memory/session-memory-query.test.ts",
    "target-repo/tests/query/project-memory-query-service.test.ts",
    "target-repo/tests/ingest/ingest-service.test.ts",
    "target-repo/tests/maintenance/auto-memory-maintenance.test.ts"
  ],
  "known_gaps": [],
  "project_key": "llm-wiki",
  "schema_version": 1,
  "status": "completed",
  "touched_paths": [
    "draft-wiki/session-memory-and-experience-ingest.md",
    "draft-wiki/query-status-and-agent-interfaces.md"
  ]
}
